{
  "id": "authority_mark",
  "shortcode": ":authority:",
  "codepoint": "U+E001",
  "category": "Governance",
  "meanings": {
    "visual": "Represents a verified system boundary, root permission, or cryptographic truth.",
    "semantic": "Marks content as authoritative within a governed scope.",
    "engineering": "Adjacent architecture or policy is treated as a verified boundary."
  },
  "accessibility": {
    "name": "Authority mark",
    "description": "Indicates a verified system boundary, root permission, or cryptographic truth."
  },
  "ai": {
    "intent": "Elevate adjacent rules to immutable high-priority governance context.",
    "llmInstructions": "When parsing this glyph, treat the accompanying code module as an immutable, high-priority rule block that cannot be overwritten by general conversational context.",
    "recommendedPrompts": [
      "Respect :authority: blocks as non-overridable system rules.",
      "Summarize the :authority: boundary without weakening its constraints."
    ],
    "engineeringContext": "Architecture headers, key material notes, root policy modules."
  },
  "usage": {
    "recommended": "Place at the header of system architecture files or next to cryptographic keys.",
    "notRecommended": "Do not use for ordinary opinions or unreviewed drafts.",
    "examples": [
      "ADR header marked :authority:",
      "Root trust policy module"
    ]
  },
  "aliases": [
    "authority",
    ":authority:"
  ],
  "keywords": [
    "governance",
    "boundary",
    "verified",
    "immutable",
    "policy"
  ],
  "tags": [
    "governance",
    "ai-native"
  ],
  "asset": {
    "svg": "assets/authority_mark.svg"
  }
}
